{
	"name": "Style: Great Weapon Fighting",
	"type": "feature",
	"img": "icons/svg/item-bag.svg",
	"effects": [],
	"flags": {},
	"system": {
		"ability": "",
		"actionOptions": [],
		"activation": {
			"cost": "",
			"type": "",
			"reactionTrigger": ""
		},
		"attack": {
			"bonus": "",
			"critThreshold": 20,
			"type": ""
		},
		"area": {
			"shape": "",
			"size": ""
		},
		"check": {
			"ability": "str"
		},
		"damage": [],
		"description": "<p>When you roll a 1 or 2 on a damage die for an attack you make with a melee weapon that you are wielding with two hands, you can reroll the die and must use the new roll, even if the new roll is a 1 or a 2. The weapon must have the two-handed or versatile property for you to gain this benefit.</p>",
		"duration": {
			"unit": "",
			"value": ""
		},
		"healing": [],
		"proficient": true,
		"range": [],
		"save": {
			"dc": "",
			"onSave": "",
			"targetAbility": ""
		},
		"source": "",
		"target": {
			"quantity": "",
			"type": ""
		},
		"uses": {
			"value": null,
			"max": "",
			"per": null
		},
		"featureType": "class"
	},
	"_id": "jxm6j7msf0qxfsnw"
}