{
  "name": "Bonus Proficiencies (Engineer)",
  "type": "feature",
  "img": "icons/svg/item-bag.svg",
  "system": {
    "ability": "",
    "actionOptions": [],
    "activation": {
      "cost": "",
      "type": "",
      "reactionTrigger": ""
    },
    "attack": {
      "bonus": "",
      "critThreshold": 20,
      "type": ""
    },
    "area": {
      "shape": ""
    },
    "check": {
      "ability": "str"
    },
    "damage": [],
    "description": "<p>When you select this archetype at 3rd level, you gain proficiency with air vehicles, land vehicles, and water vehicles. If you already had any of these proficiencies you gain an expertise die with that type of vehicle instead. </p>",
    "duration": {
      "unit": "",
      "value": ""
    },
    "healing": [],
    "proficient": true,
    "range": [],
    "save": {
      "dc": "",
      "onSave": "",
      "targetAbility": ""
    },
    "source": "",
    "target": {
      "quantity": "",
      "type": ""
    },
    "uses": {
      "value": null,
      "max": "",
      "per": null
    },
    "featureType": "class"
  },
  "effects": [],
  "flags": {},
  "_id": "9epwhm8pz2wpni0v"
}
