{
	"name": "Toll: One Eye Open",
	"type": "feature",
	"img": "icons/svg/item-bag.svg",
	"effects": [],
	"flags": {
		"core": {
			"sourceId": "Compendium.a5e.a5e-class-features.yu0rlk1kdngglbbn"
		}
	},
	"system": {
		"actions": {},
		"description": "<p>Your life has been so regularly in danger that youâ€™ve learned to literally sleep with one eye open. You are alert and aware of your surroundings while sleeping during long rests. You can also never be surprised and you gain an expertise die on initiative checks.</p>",
		"favorite": false,
		"secretDescription": "",
		"source": "",
		"uses": {
			"value": null,
			"max": "",
			"per": null,
			"recharge": {
				"formula": "1d6",
				"threshold": 6
			}
		},
		"schema": {
			"version": 0.003,
			"lastMigration": {
				"version": {
					"schema": null,
					"foundry": "10.291",
					"system": "0.10.7"
				}
			}
		},
		"featureType": "class",
		"prerequisite": "",
		"ability": "",
		"actionOptions": [],
		"activation": {
			"cost": "",
			"type": "",
			"reactionTrigger": ""
		},
		"attack": {
			"bonus": "",
			"critThreshold": 20,
			"type": ""
		},
		"area": {
			"shape": "",
			"size": ""
		},
		"check": {
			"ability": "str"
		},
		"damage": [],
		"duration": {
			"unit": "",
			"value": ""
		},
		"healing": [],
		"proficient": true,
		"range": [],
		"save": {
			"dc": "",
			"onSave": "",
			"targetAbility": ""
		},
		"target": {
			"quantity": "",
			"type": ""
		}
	},
	"_id": "yu0rlk1kdngglbbn"
}