{
  "name": "Clever Scheme: Deductive Tracker",
  "type": "feature",
  "img": "icons/svg/item-bag.svg",
  "system": {
    "ability": "",
    "actionOptions": [],
    "activation": {
      "cost": 1,
      "type": "minute",
      "reactionTrigger": ""
    },
    "attack": {
      "bonus": "",
      "critThreshold": 20,
      "type": ""
    },
    "area": {
      "shape": ""
    },
    "check": {
      "ability": "str"
    },
    "damage": [],
    "description": "<p>After observing a creature, however briefly, you make a deduction that gives you an edge when pursuing it. After you spend at least 1 minute observing a creature, you gain an expertise die on checks made to track that specific creature.</p>",
    "duration": {
      "unit": "special",
      "value": ""
    },
    "healing": [],
    "proficient": true,
    "range": [],
    "save": {
      "dc": "",
      "onSave": "",
      "targetAbility": ""
    },
    "source": "",
    "target": {
      "quantity": "",
      "type": ""
    },
    "uses": {
      "value": null,
      "max": null,
      "per": ""
    },
    "featureType": "class"
  },
  "effects": [],
  "flags": {},
  "_id": "39x916chada5lupd"
}
