{
  "name": "Clever Scheme: Reserved Seating",
  "type": "feature",
  "img": "icons/svg/item-bag.svg",
  "system": {
    "ability": "",
    "actionOptions": [],
    "activation": {
      "cost": "",
      "type": "",
      "reactionTrigger": ""
    },
    "attack": {
      "bonus": "",
      "critThreshold": 20,
      "type": ""
    },
    "area": {
      "shape": ""
    },
    "check": {
      "ability": "str"
    },
    "damage": [],
    "description": "<p>You have forethought of when and where you might need to be places. If you knew you would be in a given area, once per day you can call upon this forethought to have a vehicle or mount waiting for you and your companions, or to have a reservation available at a venue. You pay any appropriate costs. For exceptional requests, you may need to make a Persuasion check or owe someone a favor.</p>",
    "duration": {
      "unit": "",
      "value": ""
    },
    "healing": [],
    "proficient": true,
    "range": [],
    "save": {
      "dc": "",
      "onSave": "",
      "targetAbility": ""
    },
    "source": "",
    "target": {
      "quantity": "",
      "type": ""
    },
    "uses": {
      "value": 1,
      "max": 1,
      "per": "day"
    },
    "featureType": "class"
  },
  "effects": [],
  "flags": {},
  "_id": "g6el4zyuuf3r10hi"
}
