{
  "name": "Advantageous Action",
  "type": "feature",
  "img": "icons/svg/item-bag.svg",
  "effects": [],
  "flags": {},
  "system": {
    "ability": "",
    "actionOptions": [],
    "activation": {
      "cost": "",
      "type": "",
      "reactionTrigger": ""
    },
    "attack": {
      "bonus": "",
      "critThreshold": 20,
      "type": ""
    },
    "area": {
      "shape": "",
      "size": ""
    },
    "check": {
      "ability": "str"
    },
    "damage": [],
    "description": "<p><span class=\"fontstyle1\"><span class=\"fontstyle0\">Starting at 14th level, your experience in battle lets you help your companions more easily. You can use the Help action as a bonus action. In addition,</span>&nbsp;<span class=\"fontstyle0\">when you take the Help action choose one of the following effects:</span></span></p>\n<ul>\n<li><span class=\"fontstyle1\">You end the frightened condition on one creature within 30 feet of you that can hear or see you.</span></li>\n<li><span class=\"fontstyle1\">You grant one creature within 5 feet of you temporary hit points equal to your Charisma modifier.</span></li>\n<li><span class=\"fontstyle1\">You touch a living creature that has 0 hit points. The creature regains 1 hit point.</span></li>\n</ul>",
    "duration": {
      "unit": "",
      "value": ""
    },
    "healing": [],
    "proficient": true,
    "range": [],
    "save": {
      "dc": "",
      "onSave": "",
      "targetAbility": ""
    },
    "source": "",
    "target": {
      "quantity": "",
      "type": "",
      "shape": "",
      "size": ""
    },
    "uses": {
      "value": null,
      "max": "",
      "per": null
    },
    "featureType": "class",
    "favorite": false
  },
  "_id": "ywoe5wghb18ujal4"
}
