{
  "name": "Stolen Breath (recharge 5-6)",
  "type": "feature",
  "img": "icons/svg/item-bag.svg",
  "system": {
    "ability": "",
    "actionOptions": [
      "savingThrow",
      "damage"
    ],
    "activation": {
      "cost": 1,
      "type": "action",
      "reactionTrigger": ""
    },
    "attack": {
      "bonus": "",
      "critThreshold": 20,
      "type": ""
    },
    "area": {
      "shape": "cone",
      "length": 30
    },
    "check": {
      "ability": "str"
    },
    "damage": [
      {
        "canCrit": false,
        "damageType": "necrotic",
        "defaultSelection": true,
        "formula": "3d6",
        "name": "Necrotic"
      },
      {
        "canCrit": false,
        "damageType": "",
        "defaultSelection": true,
        "formula": "3d6",
        "name": "Original dragon breath type"
      }
    ],
    "description": "<p>The monster exhales the putrid and infected gullet of a fallen dragon in a 30-foot cone. Each creature in the area makes a Dexterity saving throw. A creature takes 3d6 necrotic damage and 3d6 damage of the type the dragon breathed in life on a failed saving throw, or half damage on a success.</p>",
    "duration": {
      "unit": "instantaneous",
      "value": ""
    },
    "healing": [],
    "proficient": true,
    "range": [],
    "save": {
      "dc": "",
      "onSave": "half damage",
      "targetAbility": "dex"
    },
    "source": "",
    "target": {
      "quantity": null,
      "type": ""
    },
    "uses": {
      "value": null,
      "max": null,
      "per": ""
    },
    "featureType": "naturalWeapon"
  },
  "effects": [],
  "flags": {
    "a5e": {
      "placeTemplate": true
    }
  },
  "_id": "js5aezx7oly5je4t"
}
